{
  "schema_version": "alice.source_fetch_log.v1",
  "fetch_log_id": "5126fd7a-d599-5367-afff-b3038b51db04",
  "request_id": "5c79f5db-53a2-4c49-b50a-8777d7dc1af1",
  "subject_resolution_id": "c29d05e0-3bd5-503a-8455-d3ddff38f082",
  "jurisdiction_context_id": "4784ad6b-97a1-53be-8fb2-16df6bbae9e1",
  "source_plan_id": "cc3a155b-53e4-5672-b377-3b99ba5ae314",
  "generated_at": "2026-04-17T01:15:00Z",
  "fetch_entries": [
    {
      "entry_id": "a6961b19-c716-5fa9-b717-94cf64109280",
      "source_id": "county_ca_kern_interactive_mapping",
      "source_name": "Kern County Interactive Mapping",
      "source_category": "county",
      "interface_type": "web_only",
      "capability": "parcel_geometry",
      "requested_capabilities": [
        "parcel_geometry",
        "parcel_identity",
        "planning_docs",
        "zoning"
      ],
      "source_capabilities": [
        "future_land_use",
        "parcel_geometry",
        "site_address",
        "zoning"
      ],
      "subject_ids": [
        "subject-1"
      ],
      "retrieval_status": "success",
      "execution_mode": "fixture_replay",
      "attempted_at": "2026-04-17T01:15:00Z",
      "completed_at": "2026-04-17T01:15:00Z",
      "request_descriptor": {
        "request_kind": "web_page_access",
        "method": "GET",
        "target_url": "https://www.kerncounty.com/government/departments/assessor-recorder/property/mapping-gis/interactive-mapping",
        "subject_ids": [
          "subject-1"
        ],
        "county_fips": "06029",
        "state_fips": "06",
        "coordinates": null,
        "query_params": {},
        "body_preview": null,
        "notes": []
      },
      "artifact_refs": [
        {
          "artifact_type": "raw_html",
          "path": "alice/raw_evidence/county_ca_kern_interactive_mapping/a6961b19-c716-5fa9-b717-94cf64109280.html",
          "content_type": "text/html; charset=utf-8",
          "sha256": "28448473699d1fc96526d3d87337c698750cb00ebfcc709a1fe997c4e60b9b5d",
          "byte_count": 590
        },
        {
          "artifact_type": "response_headers",
          "path": "alice/raw_evidence/county_ca_kern_interactive_mapping/a6961b19-c716-5fa9-b717-94cf64109280.headers.json",
          "content_type": "application/json",
          "sha256": "6a4d703ae2af11b30738fc7e2dc6d627ac4e61957ea1928a107e23b20cced04e",
          "byte_count": 48
        }
      ],
      "extracted_field_refs": [
        "county_ca_kern_interactive_mapping:a6961b19:page_title",
        "county_ca_kern_interactive_mapping:a6961b19:page_meta_description",
        "county_ca_kern_interactive_mapping:a6961b19:page_text_excerpt",
        "county_ca_kern_interactive_mapping:a6961b19:parcel_identity_apn_hint",
        "county_ca_kern_interactive_mapping:a6961b19:parcel_identity_site_address_hint",
        "county_ca_kern_interactive_mapping:a6961b19:parcel_identity_county_name_hint",
        "county_ca_kern_interactive_mapping:a6961b19:planning_zoning_reference"
      ],
      "parser_version": "alice.extract.v2",
      "http_status": 200,
      "error_type": "none",
      "error_message": null,
      "notes": [
        "Fetched https://www.kerncounty.com/government/departments/assessor-recorder/property/mapping-gis/interactive-mapping successfully."
      ]
    },
    {
      "entry_id": "8e21d4b5-d48d-5a00-bcd1-791d3e455b54",
      "source_id": "county_ca_kern_parcelquest_property_search",
      "source_name": "Kern County ParcelQuest Property Search",
      "source_category": "county",
      "interface_type": "web_only",
      "capability": "parcel_identity",
      "requested_capabilities": [
        "parcel_identity",
        "tax_roll"
      ],
      "source_capabilities": [
        "owner_name",
        "parcel_lookup_by_address",
        "parcel_lookup_by_apn",
        "site_address",
        "tax_roll"
      ],
      "subject_ids": [
        "subject-1"
      ],
      "retrieval_status": "success",
      "execution_mode": "fixture_replay",
      "attempted_at": "2026-04-17T01:15:00Z",
      "completed_at": "2026-04-17T01:15:00Z",
      "request_descriptor": {
        "request_kind": "web_page_access",
        "method": "GET",
        "target_url": "https://www.kerncounty.com/government/departments/assessor-recorder/property/parcelquest-property-search",
        "subject_ids": [
          "subject-1"
        ],
        "county_fips": "06029",
        "state_fips": "06",
        "coordinates": null,
        "query_params": {},
        "body_preview": null,
        "notes": []
      },
      "artifact_refs": [
        {
          "artifact_type": "raw_html",
          "path": "alice/raw_evidence/county_ca_kern_parcelquest_property_search/8e21d4b5-d48d-5a00-bcd1-791d3e455b54.html",
          "content_type": "text/html; charset=utf-8",
          "sha256": "2954180d463976092c2d3ce86e23005d1baa0adf952b532b7f3379f88b7f8a7b",
          "byte_count": 649
        },
        {
          "artifact_type": "response_headers",
          "path": "alice/raw_evidence/county_ca_kern_parcelquest_property_search/8e21d4b5-d48d-5a00-bcd1-791d3e455b54.headers.json",
          "content_type": "application/json",
          "sha256": "6a4d703ae2af11b30738fc7e2dc6d627ac4e61957ea1928a107e23b20cced04e",
          "byte_count": 48
        }
      ],
      "extracted_field_refs": [
        "county_ca_kern_parcelquest_property_search:8e21d4b5:page_title",
        "county_ca_kern_parcelquest_property_search:8e21d4b5:page_meta_description",
        "county_ca_kern_parcelquest_property_search:8e21d4b5:page_text_excerpt",
        "county_ca_kern_parcelquest_property_search:8e21d4b5:parcel_identity_apn_hint",
        "county_ca_kern_parcelquest_property_search:8e21d4b5:parcel_identity_county_parcel_id_hint",
        "county_ca_kern_parcelquest_property_search:8e21d4b5:parcel_identity_site_address_hint",
        "county_ca_kern_parcelquest_property_search:8e21d4b5:parcel_identity_owner_name_hint",
        "county_ca_kern_parcelquest_property_search:8e21d4b5:parcel_identity_legal_description_fragment",
        "county_ca_kern_parcelquest_property_search:8e21d4b5:parcel_identity_county_name_hint"
      ],
      "parser_version": "alice.extract.v2",
      "http_status": 200,
      "error_type": "none",
      "error_message": null,
      "notes": [
        "Fetched https://www.kerncounty.com/government/departments/assessor-recorder/property/parcelquest-property-search successfully."
      ]
    },
    {
      "entry_id": "8b2d3774-d722-588f-b371-ae9c54782950",
      "source_id": "county_ca_kern_gis_data",
      "source_name": "Kern County GIS Data",
      "source_category": "county",
      "interface_type": "downloadable_dataset",
      "capability": "parcel_geometry",
      "requested_capabilities": [
        "parcel_geometry"
      ],
      "source_capabilities": [
        "parcel_geometry"
      ],
      "subject_ids": [
        "subject-1"
      ],
      "retrieval_status": "success",
      "execution_mode": "fixture_replay",
      "attempted_at": "2026-04-17T01:15:00Z",
      "completed_at": "2026-04-17T01:15:00Z",
      "request_descriptor": {
        "request_kind": "dataset_landing_page_fetch",
        "method": "GET",
        "target_url": "https://www.kerncounty.com/government/departments/assessor-recorder/property/mapping-gis/gis-data",
        "subject_ids": [
          "subject-1"
        ],
        "county_fips": "06029",
        "state_fips": "06",
        "coordinates": null,
        "query_params": {},
        "body_preview": null,
        "notes": []
      },
      "artifact_refs": [
        {
          "artifact_type": "raw_html",
          "path": "alice/raw_evidence/county_ca_kern_gis_data/8b2d3774-d722-588f-b371-ae9c54782950.html",
          "content_type": "text/html; charset=utf-8",
          "sha256": "107fb231b9b6ef0569cc53f00eba07330a3b7dbb2eb8e5e477df8b9910a2300c",
          "byte_count": 407
        },
        {
          "artifact_type": "response_headers",
          "path": "alice/raw_evidence/county_ca_kern_gis_data/8b2d3774-d722-588f-b371-ae9c54782950.headers.json",
          "content_type": "application/json",
          "sha256": "6a4d703ae2af11b30738fc7e2dc6d627ac4e61957ea1928a107e23b20cced04e",
          "byte_count": 48
        }
      ],
      "extracted_field_refs": [
        "county_ca_kern_gis_data:8b2d3774:page_title",
        "county_ca_kern_gis_data:8b2d3774:page_meta_description",
        "county_ca_kern_gis_data:8b2d3774:page_text_excerpt",
        "county_ca_kern_gis_data:8b2d3774:parcel_identity_county_name_hint"
      ],
      "parser_version": "alice.extract.v2",
      "http_status": 200,
      "error_type": "none",
      "error_message": null,
      "notes": [
        "Fetched https://www.kerncounty.com/government/departments/assessor-recorder/property/mapping-gis/gis-data successfully."
      ]
    },
    {
      "entry_id": "0ea3c51a-6c6f-5ac5-88a2-e49277603829",
      "source_id": "local_ca_bakersfield_planning",
      "source_name": "Bakersfield Public Notices, Reports and Plans",
      "source_category": "city_local",
      "interface_type": "web_only",
      "capability": "planning_docs",
      "requested_capabilities": [
        "planning_docs"
      ],
      "source_capabilities": [
        "development_code",
        "future_land_use"
      ],
      "subject_ids": [
        "subject-1"
      ],
      "retrieval_status": "success",
      "execution_mode": "fixture_replay",
      "attempted_at": "2026-04-17T01:15:00Z",
      "completed_at": "2026-04-17T01:15:00Z",
      "request_descriptor": {
        "request_kind": "web_page_access",
        "method": "GET",
        "target_url": "https://www.bakersfieldcity.us/920/Public-Notices-Reports-and-Plans",
        "subject_ids": [
          "subject-1"
        ],
        "county_fips": "06029",
        "state_fips": "06",
        "coordinates": null,
        "query_params": {},
        "body_preview": null,
        "notes": []
      },
      "artifact_refs": [